{
  "$schema": "https://json-schema.org/draft/2020-12/schema",
  "$id": "https://coga.dev/schemas/factory/v0.2/agent-proposal-receipt.schema.json",
  "title": "COGA Agent Proposal Receipt",
  "type": "object",
  "additionalProperties": false,
  "required": [
    "schemaVersion",
    "kind",
    "metadata",
    "subject",
    "generator",
    "output"
  ],
  "$defs": {
    "digest": { "type": "string", "pattern": "^sha256:[0-9a-f]{64}$" },
    "gitObject": { "type": "string", "pattern": "^[0-9a-f]{40}$" },
    "relativePath": {
      "type": "string",
      "minLength": 1,
      "maxLength": 500,
      "pattern": "^(?![A-Za-z]:)(?!/)(?!.*(?:^|/)\\.\\.(?:/|$))(?!.*\\\\).+$"
    },
    "exactReference": {
      "type": "object",
      "additionalProperties": false,
      "required": ["id", "version"],
      "properties": {
        "id": { "type": "string", "minLength": 1, "maxLength": 200 },
        "version": { "type": "string", "minLength": 1, "maxLength": 100 }
      }
    },
    "fileReference": {
      "type": "object",
      "additionalProperties": false,
      "required": ["path", "digest"],
      "properties": {
        "path": { "$ref": "#/$defs/relativePath" },
        "digest": { "$ref": "#/$defs/digest" }
      }
    },
    "evidenceFile": {
      "type": "object",
      "additionalProperties": false,
      "required": ["path", "digest", "bytes"],
      "properties": {
        "path": { "$ref": "#/$defs/relativePath" },
        "digest": { "$ref": "#/$defs/digest" },
        "bytes": { "type": "integer", "minimum": 0, "maximum": 5242880 }
      }
    }
  },
  "properties": {
    "schemaVersion": { "const": "coga.dev/factory/v0.2" },
    "kind": { "const": "AgentProposalReceipt" },
    "metadata": {
      "type": "object",
      "additionalProperties": false,
      "required": ["id", "createdAt", "receiptDigest"],
      "properties": {
        "id": { "type": "string", "pattern": "^[a-z0-9][a-z0-9.-]{2,127}$" },
        "createdAt": { "type": "string", "format": "date-time" },
        "receiptDigest": { "$ref": "#/$defs/digest" }
      }
    },
    "subject": {
      "type": "object",
      "additionalProperties": false,
      "required": ["baseCommit", "change", "application", "inputs"],
      "properties": {
        "baseCommit": {
          "oneOf": [
            { "const": "work-order-commit" },
            { "$ref": "#/$defs/gitObject" }
          ]
        },
        "change": { "$ref": "#/$defs/exactReference" },
        "application": { "$ref": "#/$defs/exactReference" },
        "inputs": {
          "type": "array",
          "minItems": 4,
          "maxItems": 200,
          "items": { "$ref": "#/$defs/evidenceFile" }
        }
      }
    },
    "generator": {
      "type": "object",
      "additionalProperties": false,
      "required": ["adapter", "model", "prompt", "tools", "budget"],
      "properties": {
        "adapter": { "$ref": "#/$defs/exactReference" },
        "model": {
          "type": "object",
          "additionalProperties": false,
          "required": ["provider", "id", "version"],
          "properties": {
            "provider": { "type": "string", "minLength": 1, "maxLength": 100 },
            "id": { "type": "string", "minLength": 1, "maxLength": 200 },
            "version": { "type": "string", "minLength": 1, "maxLength": 100 }
          }
        },
        "prompt": {
          "type": "object",
          "additionalProperties": false,
          "required": ["template", "path", "digest"],
          "properties": {
            "template": { "$ref": "#/$defs/exactReference" },
            "path": { "$ref": "#/$defs/relativePath" },
            "digest": { "$ref": "#/$defs/digest" }
          }
        },
        "tools": {
          "type": "object",
          "additionalProperties": false,
          "required": ["allowed", "network", "filesystem"],
          "properties": {
            "allowed": {
              "type": "array",
              "maxItems": 50,
              "uniqueItems": true,
              "items": { "type": "string", "minLength": 1, "maxLength": 100 }
            },
            "network": { "enum": ["none", "model-provider-only"] },
            "filesystem": { "const": "read-only" }
          }
        },
        "budget": {
          "type": "object",
          "additionalProperties": false,
          "required": [
            "maxInputTokens",
            "maxOutputTokens",
            "maxToolCalls",
            "timeoutMs"
          ],
          "properties": {
            "maxInputTokens": {
              "type": "integer",
              "minimum": 1,
              "maximum": 1000000
            },
            "maxOutputTokens": {
              "type": "integer",
              "minimum": 1,
              "maximum": 1000000
            },
            "maxToolCalls": {
              "type": "integer",
              "minimum": 0,
              "maximum": 10000
            },
            "timeoutMs": { "type": "integer", "minimum": 1, "maximum": 3600000 }
          }
        }
      }
    },
    "output": {
      "type": "object",
      "additionalProperties": false,
      "required": [
        "patch",
        "normalization",
        "normalizedDigest",
        "changedPaths"
      ],
      "properties": {
        "patch": { "$ref": "#/$defs/fileReference" },
        "normalization": { "const": "coga.patch.normalization/v1" },
        "normalizedDigest": { "$ref": "#/$defs/digest" },
        "changedPaths": {
          "type": "array",
          "minItems": 1,
          "maxItems": 200,
          "uniqueItems": true,
          "items": { "$ref": "#/$defs/relativePath" }
        }
      }
    }
  }
}
